Delaware State University,Division I,Division I,DI FCS,Active Member,Mid-Eastern Athletic Conf.,Mid-Eastern Athletic Conf.,HBCU,Public,Research Universities,"Dover, DE",www.desu.edu,www.dsuhornets.com/
State University of New York Polytechnic Institute,Division III,Division III,Non-DI,Active Member,North Eastern Athletic Conference,North Eastern Athletic Conference,Non-HBCU,Public,Master's Colleges & Universities,"Utica, NY",www.sunyit.edu,www.wildcats.sunyit.edu
Skidmore College,Division III,Division III,Non-DI,Active Member,Liberty League,Liberty League,Non-HBCU,Private,Baccalaureate Colleges,"Saratoga Springs, NY",www.skidmore.edu/,www.skidmore.edu/athletics
"University of Maine, Orono",Division I,Division I,DI FCS,Active Member,America East Conference,America East Conference,Non-HBCU,Public,Research Universities,"Orono, ME",www.goblackbears.com,www.umaine.edu
Husson University,Division III,Division III,Non-DI,Active Member,North Atlantic Conference,North Atlantic Conference,Non-HBCU,Private,Research Universities,"Bangor, ME",www.husson.edu,www.hussoneagles.com
Thomas College,Division III,Division III,Non-DI,Active Member,North Atlantic Conference,North Atlantic Conference,Non-HBCU,Private,Master's Colleges & Universities,"Waterville, ME",www.thomas.edu/,www.thomasathletics.com
Colby College,Division III,Division III,Non-DI,Active Member,New England Small College Athletic Conference,New England Small College Athletic Conference,Non-HBCU,Private,Baccalaureate Colleges,"Waterville, ME",www.colby.edu,www.colby.edu/athletics
University of Maine at Presque Isle,Division III,Division III,Non-DI,Active Member,North Atlantic Conference,North Atlantic Conference,Non-HBCU,Public,Baccalaureate Colleges,"Presque Isle, ME",owls.umpi.edu/landing/index,www.umpi.edu
Bates College,Division III,Division III,Non-DI,Active Member,New England Small College Athletic Conference,New England Small College Athletic Conference,Non-HBCU,Private,Baccalaureate Colleges,"Lewiston, ME",www.bates.edu,www.bates.edu/sport.xml
Bowdoin College,Division III,Division III,Non-DI,Active Member,New England Small College Athletic Conference,New England Small College Athletic Conference,Non-HBCU,Private,Baccalaureate Colleges,"Brunswick, ME",www.bowdoin.edu,www.bowdoin.edu/athletics/
Saint Joseph's College (Maine),Division III,Division III,Non-DI,Active Member,Great Northeast Athletic Conference,Great Northeast Athletic Conference,Non-HBCU,Private,Master's Colleges & Universities,"Standish, ME",www.gomonks.com,www.sjcme.edu
University of Southern Maine,Division III,Division III,Non-DI,Active Member,Little East Conference,Little East Conference,Non-HBCU,Public,Master's Colleges & Universities,"Gorham, ME",www.southernmainehuskies.com,www.usm.maine.edu
"University of Maine, Farmington",Division III,Division III,Non-DI,Active Member,North Atlantic Conference,North Atlantic Conference,Non-HBCU,Public,Baccalaureate Colleges,"Farmington, ME",www.goUMFbeavers.com,www.umf.maine.edu/
University of Washington,Division I,Division I,DI FBS,Active Member,Pac-12 Conference,Pac-12 Conference,Non-HBCU,Public,Research Universities,"Seattle, WA",www.gohuskies.com,www.washington.edu/
University of Puget Sound,Division III,Division III,Non-DI,Active Member,Northwest Conference,Northwest Conference,Non-HBCU,Private,Baccalaureate Colleges,"Tacoma, WA",www.loggerathletics.com,www.pugetsound.edu
Saint Martin's University,Division II,Division II,Non-DI,Active Member,Great Northwest Athletic Conference,Great Northwest Athletic Conference,Non-HBCU,Private,Master's Colleges & Universities,"Lacey, WA",www.smusaints.com,www.stmartin.edu/
University of Portland,Division I,Division I,DI Subdivision,Active Member,West Coast Conference,West Coast Conference,Non-HBCU,Private,Master's Colleges & Universities,"Portland, OR",www.portlandpilots.com,www.up.edu/
George Fox University,Division III,Division III,Non-DI,Active Member,Northwest Conference,Northwest Conference,Non-HBCU,Private,Research Universities,"Newberg, OR",www.georgefox.edu,www.gfubruins.com
Western Oregon University,Division II,Division II,Non-DI,Active Member,Great Northwest Athletic Conference,Great Northwest Athletic Conference,Non-HBCU,Public,Master's Colleges & Universities,"Monmouth, OR",www.wou.edu,www.wouwolves.com
Pacific University (Oregon),Division III,Division III,Non-DI,Active Member,Northwest Conference,Northwest Conference,Non-HBCU,Private,Research Universities,"Forest Grove, OR",goboxers.com,www.pacificu.edu/
Oregon State University,Division I,Division I,DI FBS,Active Member,Pac-12 Conference,Pac-12 Conference,Non-HBCU,Public,Research Universities,"Corvallis, OR",www.oregonstate.edu/,www.osubeavers.com
University of Oregon,Division I,Division I,DI FBS,Active Member,Pac-12 Conference,Pac-12 Conference,Non-HBCU,Public,Research Universities,"Eugene, OR",www.goducks.com,www.uoregon.edu
Willamette University,Division III,Division III,Non-DI,Active Member,Northwest Conference,Northwest Conference,Non-HBCU,Private,Baccalaureate Colleges,"Salem, OR",willamette.prestosports.com/landing/index,www.willamette.edu/
Concordia University Portland,Division II,Division II,Non-DI,Active Member,Great Northwest Athletic Conference,Great Northwest Athletic Conference,Non-HBCU,Private,Research Universities,"Portland, OR",www.cu-portland.edu,www.gocugo.com
Lewis & Clark College,Division III,Division III,Non-DI,Active Member,Northwest Conference,Northwest Conference,Non-HBCU,Private,Baccalaureate Colleges,"Portland, OR",www.lclark.edu,www.lcpioneers.com
Central Washington University,Division II,Division II,Non-DI,Active Member,Great Northwest Athletic Conference,Great Northwest Athletic Conference,Non-HBCU,Public,Master's Colleges & Universities,"Ellensburg, WA",cwu.edu,wildcatsports.com
Whitworth University,Division III,Division III,Non-DI,Active Member,Northwest Conference,Northwest Conference,Non-HBCU,Private,Master's Colleges & Universities,"Spokane, WA",www.whitworth.edu/,www.whitworthpirates.com
Washington State University,Division I,Division I,DI FBS,Active Member,Pac-12 Conference,Pac-12 Conference,Non-HBCU,Public,Research Universities,"Pullman, WA",www.wsu.edu,www.wsucougars.com
Gonzaga University,Division I,Division I,DI Subdivision,Active Member,West Coast Conference,West Coast Conference,Non-HBCU,Private,Research Universities,"Spokane, WA",www.gonzaga.edu,www.gozags.com
"University of California, Berkeley",Division I,Division I,DI FBS,Active Member,Pac-12 Conference,Pac-12 Conference,Non-HBCU,Public,Research Universities,"Berkeley, CA",www.berkeley.edu,www.calbears.com
San Francisco State University,Division II,Division II,Non-DI,Active Member,California Collegiate Athletic Association,California Collegiate Athletic Association,Non-HBCU,Public,Master's Colleges & Universities,"San Francisco, CA",sfstategators.com,www.sfsu.edu/
Academy of Art University,Division II,Division II,Non-DI,Active Member,Pacific West Conference,Pacific West Conference,Non-HBCU,Private,Master's Colleges & Universities,"San Francisco, CA",www.academyart.edu,www.artuathletics.com
Stanford University,Division I,Division I,DI FBS,Active Member,Pac-12 Conference,Pac-12 Conference,Non-HBCU,Private,Research Universities,"Stanford, CA",www.gostanford.com,www.stanford.edu
University of San Francisco,Division I,Division I,DI Subdivision,Active Member,West Coast Conference,West Coast Conference,Non-HBCU,Private,Research Universities,"San Francisco, CA",www.USFDons.com,www.usfca.edu
Saint Mary's College of California,Division I,Division I,DI Subdivision,Active Member,West Coast Conference,West Coast Conference,Non-HBCU,Private,Master's Colleges & Universities,"Moraga, CA",www.SMCGaels.com,www.stmarys-ca.edu/
"California State University, East Bay",Division II,Division II,Non-DI,Active Member,California Collegiate Athletic Association,California Collegiate Athletic Association,Non-HBCU,Public,Master's Colleges & Universities,"Hayward, CA",www.csueastbay.edu,www.eastbaypioneers.com
San Jose State University,Division I,Division I,DI FBS,Active Member,Mountain West Conference,Mountain West Conference,Non-HBCU,Public,Master's Colleges & Universities,"San Jose, CA",www.sjsu.edu,www.sjsuspartans.com
"California State University, Sacramento",Division I,Division I,DI FCS,Active Member,Big Sky Conference,Western Athletic Conference,Non-HBCU,Public,Master's Colleges & Universities,"Sacramento, CA",www.csus.edu,www.hornetsports.com
University of the Pacific,Division I,Division I,DI Subdivision,Active Member,West Coast Conference,West Coast Conference,Non-HBCU,Private,Research Universities,"Stockton, CA",www.pacific.edu/,www.pacifictigers.com
"University of California, Davis",Division I,Division I,DI FCS,Active Member,Big West Conference,Big West Conference,Non-HBCU,Public,Research Universities,"Davis, CA",www.ucdavis.edu,www.ucdavisaggies.com
"California State University, Stanislaus",Division II,Division II,Non-DI,Active Member,California Collegiate Athletic Association,California Collegiate Athletic Association,Non-HBCU,Public,Master's Colleges & Universities,"Turlock, CA",www.csustan.edu,www.warriorathletics.com
"California State University, Monterey Bay",Division II,Division II,Non-DI,Active Member,California Collegiate Athletic Association,California Collegiate Athletic Association,Non-HBCU,Public,Master's Colleges & Universities,"Seaside, CA",www.csumb.edu,www.otterathletics.com
Sonoma State University,Division II,Division II,Non-DI,Active Member,California Collegiate Athletic Association,California Collegiate Athletic Association,Non-HBCU,Public,Master's Colleges & Universities,"Rohnert Park, CA",www.sonoma.edu/,www.sonomaseawolves.com
"California State University, Chico",Division II,Division II,Non-DI,Active Member,California Collegiate Athletic Association,California Collegiate Athletic Association,Non-HBCU,Public,Master's Colleges & Universities,"Chico, CA",www.chicowildcats.com,www.csuchico.edu
"University of Nevada, Reno",Division I,Division I,DI FBS,Active Member,Mountain West Conference,Mountain West Conference,Non-HBCU,Public,Research Universities,"Reno, NV",www.nevadawolfpack.com,www.unr.edu
California Polytechnic State University,Division I,Division I,DI FCS,Active Member,Big West Conference,Big West Conference,Non-HBCU,Public,Master's Colleges & Universities,"San Luis Obispo, CA",gopoly.com,www.calpoly.edu
Fresno Pacific University,Division II,Division II,Non-DI,Active Member,Pacific West Conference,Pacific West Conference,Non-HBCU,Private,Master's Colleges & Universities,"Fresno, CA",fpuathletics.com/,www.fresno.edu
"California State University, Fresno",Division I,Division I,DI FBS,Active Member,Mountain West Conference,Mountain West Conference,Non-HBCU,Public,Research Universities,"Fresno, CA",www.csufresno.edu,www.gobulldogs.com
"University of California, Santa Barbara",Division I,Division I,DI Subdivision,Active Member,Big West Conference,Big West Conference,Non-HBCU,Public,Research Universities,"Santa Barbara, CA",ucsbgauchos.com,www.ucsb.edu
California Institute of Technology,Division III,Division III,Non-DI,Active Member,Southern California Intercollegiate Athletic Conf.,Southern California Intercollegiate Athletic Conf.,Non-HBCU,Private,Research Universities,"Pasadena, CA",www.caltech.edu,www.gocaltech.com
"California State University, Northridge",Division I,Division I,DI Subdivision,Active Member,Big West Conference,Big West Conference,Non-HBCU,Public,Master's Colleges & Universities,"Northridge, CA",www.GoMatadors.com,www.csun.edu
California Lutheran University,Division III,Division III,Non-DI,Active Member,Southern California Intercollegiate Athletic Conf.,Southern California Intercollegiate Athletic Conf.,Non-HBCU,Private,Master's Colleges & Universities,"Thousand Oaks, CA",www.callutheran.edu,www.clusports.com
"California State University, Bakersfield",Division I,Division I,DI Subdivision,Active Member,Western Athletic Conference,Western Athletic Conference,Non-HBCU,Public,Master's Colleges & Universities,"Bakersfield, CA",www.csub.edu,www.gorunners.com
Occidental College,Division III,Division III,Non-DI,Active Member,Southern California Intercollegiate Athletic Conf.,Southern California Intercollegiate Athletic Conf.,Non-HBCU,Private,Baccalaureate Colleges,"Los Angeles, CA",www.oxy.edu,www.oxyathletics.com
Pepperdine University,Division I,Division I,DI Subdivision,Active Member,West Coast Conference,West Coast Conference,Non-HBCU,Private,Research Universities,"Malibu, CA",www.pepperdine.edu/,www.pepperdinesports.com
"University of California, Los Angeles",Division I,Division I,DI FBS,Active Member,Pac-12 Conference,Pac-12 Conference,Non-HBCU,Public,Research Universities,"Los Angeles, CA",www.ucla.edu,www.uclabruins.com
Loyola Marymount University,Division I,Division I,DI Subdivision,Active Member,West Coast Conference,West Coast Conference,Non-HBCU,Private,Research Universities,"Los Angeles, CA",www.LMULions.com,www.lmu.edu
"California State University, Dominguez Hills",Division II,Division II,Non-DI,Active Member,California Collegiate Athletic Association,California Collegiate Athletic Association,Non-HBCU,Public,Master's Colleges & Universities,"Carson, CA",www.csudh.edu,www.gotoros.com
Long Beach State University,Division I,Division I,DI Subdivision,Active Member,Big West Conference,Big West Conference,Non-HBCU,Public,Master's Colleges & Universities,"Long Beach, CA",longbeachstate.com,www.csulb.edu
"California State University, Los Angeles",Division II,Division II,Non-DI,Active Member,California Collegiate Athletic Association,California Collegiate Athletic Association,Non-HBCU,Public,Master's Colleges & Universities,"Los Angeles, CA",www.calstatela.edu,www.calstatelaathletics.com
Biola University,Division II,Division II,Non-DI,Active Member,Pacific West Conference,Pacific West Conference,Non-HBCU,Private,Research Universities,"La Mirada, CA",athletics.biola.edu/,www.biola.edu/
Whittier College,Division III,Division III,Non-DI,Active Member,Southern California Intercollegiate Athletic Conf.,Southern California Intercollegiate Athletic Conf.,Non-HBCU,Private,Baccalaureate Colleges,"Whittier, CA",www.wcpoets.com,www.whittier.edu
"California State University, Fullerton",Division I,Division I,DI Subdivision,Active Member,Big West Conference,Big West Conference,Non-HBCU,Public,Master's Colleges & Universities,"Fullerton, CA",www.fullerton.edu,www.fullertontitans.com
"California State Polytechnic University, Pomona",Division II,Division II,Non-DI,Active Member,California Collegiate Athletic Association,California Collegiate Athletic Association,Non-HBCU,Public,Master's Colleges & Universities,"Pomona, CA",www.broncoathletics.com,www.cpp.edu
Concordia University Irvine,Division II,Division II,Non-DI,Active Member,Pacific West Conference,Pacific West Conference,Non-HBCU,Private,Master's Colleges & Universities,"Irvine, CA",www.cui.edu,www.cuieagles.com
Chapman University,Division III,Division III,Non-DI,Active Member,Southern California Intercollegiate Athletic Conf.,Southern California Intercollegiate Athletic Conf.,Non-HBCU,Private,Research Universities,"Orange, CA",www.chapman.edu,www.chapmanathletics.com
"California State University, San Bernardino",Division II,Division II,Non-DI,Active Member,California Collegiate Athletic Association,California Collegiate Athletic Association,Non-HBCU,Public,Master's Colleges & Universities,"San Bernardino, CA",www.csusb.edu,www.csusbathletics.com
California Baptist University,Division II,Division II,Non-DI,II Reclassifying to I (B20.5.2.1),Western Athletic Conference,Western Athletic Conference,Non-HBCU,Private,Master's Colleges & Universities,"Riverside, CA",www.calbaptist.edu,www.cbulancers.com
Claremont McKenna-Harvey Mudd-Scripps Colleges,Division III,Division III,Non-DI,Active Member,Southern California Intercollegiate Athletic Conf.,Southern California Intercollegiate Athletic Conf.,Non-HBCU,Private,Baccalaureate Colleges,"Claremont, CA",www.claremontmckenna.edu,www.cmsathletics.org
Azusa Pacific University,Division II,Division II,Non-DI,Active Member,Pacific West Conference,Pacific West Conference,Non-HBCU,Private,Research Universities,"Azusa, CA",www.apu.edu,www.apu.edu/athletics
University of Redlands,Division III,Division III,Non-DI,Active Member,Southern California Intercollegiate Athletic Conf.,Southern California Intercollegiate Athletic Conf.,Non-HBCU,Private,Master's Colleges & Universities,"Redlands, CA",www.goredlands.com,www.redlands.edu
San Diego State University,Division I,Division I,DI FBS,Active Member,Mountain West Conference,Mountain West Conference,Non-HBCU,Public,Research Universities,"San Diego, CA",www.goaztecs.com,www.sdsu.edu/
"California State University, San Marcos",Division II,Division II,Non-DI,Active Member,California Collegiate Athletic Association,California Collegiate Athletic Association,Non-HBCU,Public,Master's Colleges & Universities,"San Marcos, CA",csusmcougars.com,www.csusm.edu
Point Loma Nazarene University,Division II,Division II,Non-DI,Active Member,Pacific West Conference,Pacific West Conference,Non-HBCU,Private,Master's Colleges & Universities,"San Diego, CA",www.plnusealions.com,www.pointloma.edu
"University of California, San Diego",Division II,Division II,Non-DI,Active Member,California Collegiate Athletic Association,California Collegiate Athletic Association,Non-HBCU,Public,Research Universities,"La Jolla, CA",www.ucsd.edu,www.ucsdtritons.com
"University of Nevada, Las Vegas",Division I,Division I,DI FBS,Active Member,Mountain West Conference,Mountain West Conference,Non-HBCU,Public,Research Universities,"Las Vegas, NV",www.unlv.edu,www.unlvrebels.com
Northwest Nazarene University,Division II,Division II,Non-DI,Active Member,Great Northwest Athletic Conference,Great Northwest Athletic Conference,Non-HBCU,Private,Master's Colleges & Universities,"Nampa, ID",nnusports.com,www.nnu.edu
Boise State University,Division I,Division I,DI FBS,Active Member,Mountain West Conference,Mountain West Conference,Non-HBCU,Public,Research Universities,"Boise, ID",www.boisestate.edu,www.broncosports.com
University of Utah,Division I,Division I,DI FBS,Active Member,Pac-12 Conference,Pac-12 Conference,Non-HBCU,Public,Research Universities,"Salt Lake City, UT",utahutes.cstv.com/,www.utah.edu/
Brigham Young University,Division I,Division I,DI FBS,Active Member,West Coast Conference,West Coast Conference,Non-HBCU,Private,Research Universities,"Provo, UT",www.byu.edu,www.byucougars.com
Utah Valley University,Division I,Division I,DI Subdivision,Active Member,Western Athletic Conference,Western Athletic Conference,Non-HBCU,Public,Master's Colleges & Universities,"Orem, UT",www.uvu.edu,www.wolverinegreen.com
Dixie State University,Division II,Division II,Non-DI,Active Member,Rocky Mountain Athletic Conference,Rocky Mountain Athletic Conference,Non-HBCU,Public,Baccalaureate Colleges,"St. George, UT",www.dixie.edu,www.dixieathletics.com
Arizona State University,Division I,Division I,DI FBS,Active Member,Pac-12 Conference,Pac-12 Conference,Non-HBCU,Public,Research Universities,"Tempe, AZ",asu.edu,www.thesundevils.com/
University of Arizona,Division I,Division I,DI FBS,Active Member,Pac-12 Conference,Pac-12 Conference,Non-HBCU,Public,Research Universities,"Tucson, AZ",www.arizona.edu,www.arizonawildcats.com
Grand Canyon University,Division I,Division I,DI Subdivision,Active Member,Western Athletic Conference,Western Athletic Conference,Non-HBCU,Private,Research Universities,"Phoenix, AZ",www.gcu.edu/,www.gculopes.com
Montana State University Billings,Division II,Division II,Non-DI,Active Member,Great Northwest Athletic Conference,Great Northwest Athletic Conference,Non-HBCU,Public,Master's Colleges & Universities,"Billings, MT",www.msubillings.edu,www.msubsports.com
Colorado Mesa University,Division II,Division II,Non-DI,Active Member,Rocky Mountain Athletic Conference,Rocky Mountain Athletic Conference,Non-HBCU,Public,Master's Colleges & Universities,"Grand Junction, CO",www.cmumavericks.com,www.coloradomesa.edu
Metropolitan State University of Denver,Division II,Division II,Non-DI,Active Member,Rocky Mountain Athletic Conference,Rocky Mountain Athletic Conference,Non-HBCU,Public,Master's Colleges & Universities,"Denver, CO",www.msudenver.edu,www.roadrunnersathletics.com
U.S. Air Force Academy,Division I,Division I,DI FBS,Active Member,Mountain West Conference,Mountain West Conference,Non-HBCU,Public,Baccalaureate Colleges,"USAF Academy, CO",www.goairforcefalcons.com/,www.usafa.edu
University of New Mexico,Division I,Division I,DI FBS,Active Member,Mountain West Conference,Mountain West Conference,Non-HBCU,Public,Research Universities,"Albuquerque, NM",www.golobos.com,www.unm.edu/
New Mexico State University,Division I,Division I,DI FBS,Active Member,Western Athletic Conference,Western Athletic Conference,Non-HBCU,Public,Research Universities,"Las Cruces, NM",www.nmstatesports.com,www.nmsu.edu
Adams State University,Division II,Division II,Non-DI,Active Member,Rocky Mountain Athletic Conference,Rocky Mountain Athletic Conference,Non-HBCU,Public,Master's Colleges & Universities,"Alamosa, CO",www.adams.edu,www.asugrizzlies.com
Regis University (Colorado),Division II,Division II,Non-DI,Active Member,Rocky Mountain Athletic Conference,Rocky Mountain Athletic Conference,Non-HBCU,Private,Research Universities,"Denver, CO",www.regis.edu/,www.regisrangers.com
New Mexico Highlands University,Division II,Division II,Non-DI,Active Member,Rocky Mountain Athletic Conference,Rocky Mountain Athletic Conference,Non-HBCU,Public,Master's Colleges & Universities,"Las Vegas, NM",www.nmhu.edu,www.nmhucowboys.com
Sul Ross State University,Division III,Division III,Non-DI,Active Member,American Southwest Conference,American Southwest Conference,Non-HBCU,Public,Master's Colleges & Universities,"Alpine, TX",www.srlobos.com,www.sulross.edu/
The University of Texas Rio Grande Valley,Division I,Division I,DI Subdivision,Active Member,Western Athletic Conference,Western Athletic Conference,Non-HBCU,Public,Research Universities,"Edinburg, TX",goutrgv.com,www.utrgv.edu
Texas A&M International University,Division II,Division II,Non-DI,Active Member,Lone Star Conference,Lone Star Conference,Non-HBCU,Public,Master's Colleges & Universities,"Laredo, TX",www.tamiu.edu,www.tamiu.edu/athletics/
Texas A&M University-Kingsville,Division II,Division II,Non-DI,Active Member,Lone Star Conference,Lone Star Conference,Non-HBCU,Public,Research Universities,"Kingsville, TX",www.javelinaathletics.com,www.tamuk.edu/
Texas A&M University-Corpus Christi,Division I,Division I,DI Subdivision,Active Member,Southland Conference,Southland Conference,Non-HBCU,Public,Research Universities,"Corpus Christi, TX",www.goislanders.com,www.tamucc.edu/
St. Mary's University (Texas),Division II,Division II,Non-DI,Active Member,Lone Star Conference,Lone Star Conference,Non-HBCU,Private,Master's Colleges & Universities,"San Antonio, TX",www.rattlerathletics.com,www.stmarytx.edu/
University of Texas at San Antonio,Division I,Division I,DI FBS,Active Member,Conference USA,Conference USA,Non-HBCU,Public,Research Universities,"San Antonio, TX",www.goutsa.com,www.utsa.edu
Colorado Christian University,Division II,Division II,Non-DI,Active Member,Rocky Mountain Athletic Conference,Rocky Mountain Athletic Conference,Non-HBCU,Private,Master's Colleges & Universities,"Lakewood, CO",www.ccu.edu,www.ccucougars.com
Angelo State University,Division II,Division II,Non-DI,Active Member,Lone Star Conference,Lone Star Conference,Non-HBCU,Public,Master's Colleges & Universities,"San Angelo, TX",www.angelo.edu,www.angelosports.com
University of Texas of the Permian Basin,Division II,Division II,Non-DI,Active Member,Lone Star Conference,Lone Star Conference,Non-HBCU,Public,Master's Colleges & Universities,"Odessa, TX",www.utpb.edu/,www.utpbfalcons.com
Colorado School of Mines,Division II,Division II,Non-DI,Active Member,Rocky Mountain Athletic Conference,Rocky Mountain Athletic Conference,Non-HBCU,Public,Research Universities,"Golden, CO",www.csmorediggers.com/landing/index,www.mines.edu
Lubbock Christian University,Division II,Division II,Non-DI,Active Member,Lone Star Conference,Lone Star Conference,Non-HBCU,Private,Master's Colleges & Universities,"Lubbock, TX",www.lcu.edu,www.lcuchaps.com
Eastern New Mexico University,Division II,Division II,Non-DI,Active Member,Lone Star Conference,Lone Star Conference,Non-HBCU,Public,Master's Colleges & Universities,"Portales, NM",www.enmu.edu,www.goeasternathletics.com
McMurry University,Division III,Division III,Non-DI,Active Member,American Southwest Conference,American Southwest Conference,Non-HBCU,Private,Baccalaureate Colleges,"Abilene, TX",www.mcm.edu,www.mcmurrysports.com
Southwestern University (Texas),Division III,Division III,Non-DI,Active Member,Southern Collegiate Athletic Conference,Southern Collegiate Athletic Conference,Non-HBCU,Private,Baccalaureate Colleges,"Georgetown, TX",www.southwestern.edu,www.southwesternpirates.com
University of Mary Hardin-Baylor,Division III,Division III,Non-DI,Active Member,American Southwest Conference,American Southwest Conference,Non-HBCU,Private,Master's Colleges & Universities,"Belton, TX",www.umhb.edu,www.umhb.edu/athletics
Tarleton State University,Division II,Division II,Non-DI,Active Member,Lone Star Conference,Lone Star Conference,Non-HBCU,Public,Master's Colleges & Universities,"Stephenville, TX",tarletonsports.com,www.tarleton.edu/
St. Edward's University,Division II,Division II,Non-DI,Active Member,Lone Star Conference,Lone Star Conference,Non-HBCU,Private,Master's Colleges & Universities,"Austin, TX",www.GoHilltoppers.com,www.stedwards.edu/
University of Texas at Austin,Division I,Division I,DI FBS,Active Member,Big 12 Conference,Big 12 Conference,Non-HBCU,Public,Research Universities,"Austin, TX",www.TexasSports.com,www.utexas.edu
