Delaware State University,Division I,Division I,DI FCS,Active Member,Mid-Eastern Athletic Conf.,Mid-Eastern Athletic Conf.,HBCU,Public,Research Universities,"Dover, DE",www.desu.edu,www.dsuhornets.com/
Nichols College,Division III,Division III,Non-DI,Active Member,Commonwealth Coast Conference,Commonwealth Coast Conference,Non-HBCU,Private,Special Focus Schools,"Dudley, MA",www.nichols.edu,www.nicholsathletics.com
Fitchburg State University,Division III,Division III,Non-DI,Active Member,Massachusetts State Collegiate Athletic Conference,Massachusetts State Collegiate Athletic Conference,Non-HBCU,Public,Master's Colleges & Universities,"Fitchburg, MA",www.fitchburgfalcons.com,www.fitchburgstate.edu
Endicott College,Division III,Division III,Non-DI,Active Member,Commonwealth Coast Conference,Commonwealth Coast Conference,Non-HBCU,Private,Master's Colleges & Universities,"Beverly, MA",www.ecgulls.com,www.endicott.edu
Keene State College,Division III,Division III,Non-DI,Active Member,Little East Conference,Little East Conference,Non-HBCU,Public,Baccalaureate Colleges,"Keene, NH",www.keene.edu,www.keeneowls.com
Southern New Hampshire University,Division II,Division II,Non-DI,Active Member,Northeast-10 Conference,Northeast-10 Conference,Non-HBCU,Private,Master's Colleges & Universities,"Manchester, NH",www.snhu.edu,www.snhupenmen.com
Ohio Wesleyan University,Division III,Division III,Non-DI,Active Member,North Coast Athletic Conference,North Coast Athletic Conference,Non-HBCU,Private,Baccalaureate Colleges,"Delaware, OH",www.http://battlingbishops.com,www.owu.edu/
Ball State University,Division I,Division I,DI FBS,Active Member,Mid-American Conference,Mid-American Conference,Non-HBCU,Public,Research Universities,"Muncie, IN",www.ballstatesports.com,www.bsu.edu
University of Illinois Urbana-Champaign,Division I,Division I,DI FBS,Active Member,Big Ten Conference,Big Ten Conference,Non-HBCU,Public,Research Universities,"Champaign, IL",www.fightingillini.com,www.illinois.edu
Marshall University,Division I,Division I,DI FBS,Active Member,Conference USA,Conference USA,Non-HBCU,Public,Research Universities,"Huntington, WV",www.herdzone.com,www.marshall.edu
St. Joseph's College (Long Island),Division III,Division III,Non-DI,Active Member,Skyline Conference,Skyline Conference,Non-HBCU,Private,Master's Colleges & Universities,"Patchogue, NY",www.goldeneagles.com,www.sjcny.edu/
Adelphi University,Division II,Division II,Non-DI,Active Member,Northeast-10 Conference,Northeast-10 Conference,Non-HBCU,Private,Research Universities,"Garden City, NY",www.adelphi.edu,www.aupanthers.com
Monmouth University,Division I,Division I,DI FCS,Active Member,Metro Atlantic Athletic Conference,Metro Atlantic Athletic Conference,Non-HBCU,Private,Master's Colleges & Universities,"West Long Branch, NJ",www.monmouth.edu/,www.monmouthhawks.com
Bloomfield College,Division II,Division II,Non-DI,Active Member,Central Atlantic Collegiate Conference,Central Atlantic Collegiate Conference,Non-HBCU,Private,Baccalaureate Colleges,"Bloomfield, NJ",www.bcbearsathletics.com,www.bloomfield.edu
Delaware Valley University,Division III,Division III,Non-DI,Active Member,Middle Atlantic Conferences,Middle Atlantic Conference Freedom,Non-HBCU,Private,Master's Colleges & Universities,"Doylestown, PA",www.delval.edu,www.delval.edu/athletics
Princeton University,Division I,Division I,DI FCS,Active Member,The Ivy League,The Ivy League,Non-HBCU,Private,Research Universities,"Princeton, NJ",www.goprincetontigers.com,www.princeton.edu
The College of New Jersey,Division III,Division III,Non-DI,Active Member,New Jersey Athletic Conference,New Jersey Athletic Conference,Non-HBCU,Public,Master's Colleges & Universities,"Ewing, NJ",tcnjathletics.com,www.tcnj.edu/
Rowan University,Division III,Division III,Non-DI,Active Member,New Jersey Athletic Conference,New Jersey Athletic Conference,Non-HBCU,Public,Research Universities,"Glassboro, NJ",www.rowan.edu/,www.rowanathletics.com
Millersville University of Pennsylvania,Division II,Division II,Non-DI,Active Member,Pennsylvania State Athletic Conference,Pennsylvania State Athletic Conference,Non-HBCU,Public,Master's Colleges & Universities,"Millersville, PA",www.millersville.edu/index.php,www.millersvilleathletics.com/index.aspx
Kutztown University of Pennsylvania,Division II,Division II,Non-DI,Active Member,Pennsylvania State Athletic Conference,Pennsylvania State Athletic Conference,Non-HBCU,Public,Master's Colleges & Universities,"Kutztown, PA",www.kubears.com,www.kutztown.edu
Lehigh University,Division I,Division I,DI FCS,Active Member,Patriot League,Patriot League,Non-HBCU,Private,Research Universities,"Bethlehem, PA",www.lehighsports.com/,www1.lehigh.edu/
Centenary University (New Jersey),Division III,Division III,Non-DI,Active Member,Colonial States Athletic Conference,Colonial States Athletic Conference,Non-HBCU,Private,Master's Colleges & Universities,"Hackettstown, NJ",www.centenarycollege.edu,www.centenarycyclones.com
Susquehanna University,Division III,Division III,Non-DI,Active Member,Landmark Conference,Landmark Conference,Non-HBCU,Private,Baccalaureate Colleges,"Selinsgrove, PA",www.gosusqu.com,www.susqu.edu
Gettysburg College,Division III,Division III,Non-DI,Active Member,Centennial Conference,Centennial Conference,Non-HBCU,Private,Baccalaureate Colleges,"Gettysburg, PA",gettysburgsports.com,www.gettysburg.edu
Stevenson University,Division III,Division III,Non-DI,Active Member,Middle Atlantic Conferences,Middle Atlantic Conference Commonwealth,Non-HBCU,Private,Master's Colleges & Universities,"Stevenson, MD",www.gomustangsports.com,www.stevenson.edu
Stockton University,Division III,Division III,Non-DI,Active Member,New Jersey Athletic Conference,New Jersey Athletic Conference,Non-HBCU,Public,Master's Colleges & Universities,"Galloway, NJ",www.stockton.edu,www.stocktonathletics.com
Salisbury University,Division III,Division III,Non-DI,Active Member,Capital Athletic Conference Inc.,Capital Athletic Conference Inc.,Non-HBCU,Public,Master's Colleges & Universities,"Salisbury, MD",www.salisbury.edu/,www.salisbury.edu/athletics/
University of Maryland Eastern Shore,Division I,Division I,DI Subdivision,Active Member,Mid-Eastern Athletic Conf.,Mid-Eastern Athletic Conf.,HBCU,Public,Research Universities,"Princess Anne, MD",www.umes.edu,www.umeshawks.com
William & Mary,Division I,Division I,DI FCS,Active Member,Colonial Athletic Association,Colonial Athletic Association,Non-HBCU,Public,Research Universities,"Williamsburg, VA",Tribeathletics.com,www.wm.edu/
St. Mary's College of Maryland,Division III,Division III,Non-DI,Active Member,Capital Athletic Conference Inc.,Capital Athletic Conference Inc.,Non-HBCU,Public,Baccalaureate Colleges,"St. Mary's City, MD",www.smcm.edu/,www.smcmathletics.com
Virginia Wesleyan University,Division III,Division III,Non-DI,Active Member,Old Dominion Athletic Conf.,Old Dominion Athletic Conf.,Non-HBCU,Private,Baccalaureate Colleges,"Virginia Beach, VA",vwcathletics.com/landing/index,www.vwc.edu/
Chowan University,Division II,Division II,Non-DI,Active Member,Conference Carolinas,Conference Carolinas,Non-HBCU,Private,Baccalaureate Colleges,"Murfreesboro, NC",www.chowan.edu,www.gocuhawks.com
Virginia State University,Division II,Division II,Non-DI,Active Member,Central Intercollegiate Athletic Association,Independent,HBCU,Public,Master's Colleges & Universities,"Petersburg, VA",www.govsutrojans.com,www.vsu.edu/
Randolph-Macon College,Division III,Division III,Non-DI,Active Member,Old Dominion Athletic Conf.,Old Dominion Athletic Conf.,Non-HBCU,Private,Baccalaureate Colleges,"Ashland, VA",www.rmc.edu/,www.rmcathletics.com
University of Mary Washington,Division III,Division III,Non-DI,Active Member,Capital Athletic Conference Inc.,Capital Athletic Conference Inc.,Non-HBCU,Public,Master's Colleges & Universities,"Fredericksburg, VA",www.umw.edu/,www.umweagles.com
George Mason University,Division I,Division I,DI Subdivision,Active Member,Atlantic 10 Conference,Atlantic 10 Conference,Non-HBCU,Public,Research Universities,"Fairfax, VA",www.gmu.edu,www.gomason.com
Gallaudet University,Division III,Division III,Non-DI,Active Member,North Eastern Athletic Conference,North Eastern Athletic Conference,Non-HBCU,Private,Research Universities,"Washington, DC",www.gallaudet.edu,www.gallaudetathletics.com
Shenandoah University,Division III,Division III,Non-DI,Active Member,Old Dominion Athletic Conf.,Old Dominion Athletic Conf.,Non-HBCU,Private,Research Universities,"Winchester, VA",www.su.edu,www.suhornets.com
Shepherd University,Division II,Division II,Non-DI,Active Member,Pennsylvania State Athletic Conference,Pennsylvania State Athletic Conference,Non-HBCU,Public,Baccalaureate Colleges,"Shepherdstown, WV",www.shepherd.edu/,www.shepherdrams.com
Dickinson College,Division III,Division III,Non-DI,Active Member,Centennial Conference,Centennial Conference,Non-HBCU,Private,Baccalaureate Colleges,"Carlisle, PA",www.dickinson.edu,www.dickinson.edu/sports
Juniata College,Division III,Division III,Non-DI,Active Member,Landmark Conference,Landmark Conference,Non-HBCU,Private,Baccalaureate Colleges,"Huntingdon, PA",www.juniata.edu/,www.juniatasports.net
"University of Pittsburgh, Johnstown",Division II,Division II,Non-DI,Active Member,Pennsylvania State Athletic Conference,Pennsylvania State Athletic Conference,Non-HBCU,Public,Baccalaureate Colleges,"Johnstown, PA",pittjohnstownathletics.com/,www.upj.pitt.edu
California University of Pennsylvania,Division II,Division II,Non-DI,Active Member,Pennsylvania State Athletic Conference,Pennsylvania State Athletic Conference,Non-HBCU,Public,Master's Colleges & Universities,"California, PA",www.calu.edu,www.calvulcans.com
Alderson Broaddus University,Division II,Division II,Non-DI,Active Member,Great Midwest Athletic Conference,Great Midwest Athletic Conference,Non-HBCU,Private,Baccalaureate Colleges,"Philippi, WV",ab.edu,www.gobattlers.com
Davis & Elkins College,Division II,Division II,Non-DI,Active Member,Mountain East Conference,Mountain East Conference,Non-HBCU,Private,Baccalaureate Colleges,"Elkins, WV",www.dewv.edu,www.senatornation.com
Glenville State College,Division II,Division II,Non-DI,Active Member,Mountain East Conference,Mountain East Conference,Non-HBCU,Public,Baccalaureate Colleges,"Glenville, WV",www.glenville.edu,www.gscpioneers.com/
Salem University (West Virginia),Division II,Division II,Non-DI,Active Member,Independent,Independent,Non-HBCU,Private,Master's Colleges & Universities,"Salem, WV",www.SIUTigerPride.com,www.salemu.edu/
Waynesburg University,Division III,Division III,Non-DI,Active Member,Presidents' Athletic Conference,Presidents' Athletic Conference,Non-HBCU,Private,Master's Colleges & Universities,"Waynesburg, PA",sports.waynesburg.edu,www.waynesburg.edu/
Wheeling University,Division II,Division II,Non-DI,Active Member,Mountain East Conference,Mountain East Conference,Non-HBCU,Private,Master's Colleges & Universities,"Wheeling, WV",www.wju.edu/,www.wju.edu/athletics/
Franciscan University of Steubenville,Division III,Division III,Non-DI,Active Member,Allegheny Mountain Collegiate Conference,Allegheny Mountain Collegiate Conference,Non-HBCU,Private,Master's Colleges & Universities,"Steubenville, OH",www.franciscan.edu,www.franciscanathletics.com
Clarion University of Pennsylvania,Division II,Division II,Non-DI,Active Member,Pennsylvania State Athletic Conference,Pennsylvania State Athletic Conference,Non-HBCU,Public,Master's Colleges & Universities,"Clarion, PA",www.clarion.edu,www.clariongoldeneagles.com/
Allegheny College,Division III,Division III,Non-DI,Active Member,North Coast Athletic Conference,North Coast Athletic Conference,Non-HBCU,Private,Baccalaureate Colleges,"Meadville, PA",www.allegheny.edu,www.alleghenygators.com
Thiel College,Division III,Division III,Non-DI,Active Member,Presidents' Athletic Conference,Presidents' Athletic Conference,Non-HBCU,Private,Baccalaureate Colleges,"Greenville, PA",www.thiel.edu,www.thielathletics.com
Slippery Rock University of Pennsylvania,Division II,Division II,Non-DI,Active Member,Pennsylvania State Athletic Conference,Pennsylvania State Athletic Conference,Non-HBCU,Public,Master's Colleges & Universities,"Slippery Rock, PA",www.rockathletics.com,www.sru.edu/
Youngstown State University,Division I,Division I,DI FCS,Active Member,Horizon League,Horizon League,Non-HBCU,Public,Master's Colleges & Universities,"Youngstown, OH",www.ysu.edu/,www.ysusports.com
Malone University,Division II,Division II,Non-DI,Active Member,Great Midwest Athletic Conference,Great Midwest Athletic Conference,Non-HBCU,Private,Master's Colleges & Universities,"Canton, OH",www.malone.edu,www.malonepioneers.com
Hiram College,Division III,Division III,Non-DI,Active Member,North Coast Athletic Conference,North Coast Athletic Conference,Non-HBCU,Private,Baccalaureate Colleges,"Hiram, OH",www.hiram.edu,www.hiramterriers.com
Kent State University,Division I,Division I,DI FBS,Active Member,Mid-American Conference,Mid-American Conference,Non-HBCU,Public,Research Universities,"Kent, OH",www.kent.edu/,www.kentstatesports.com
The College of Wooster,Division III,Division III,Non-DI,Active Member,North Coast Athletic Conference,North Coast Athletic Conference,Non-HBCU,Private,Baccalaureate Colleges,"Wooster, OH",www.wooster.edu,www.woosterathletics.com
Ashland University,Division II,Division II,Non-DI,Active Member,Great Lakes Intercollegiate Athletic Conference,Great Lakes Intercollegiate Athletic Conference,Non-HBCU,Private,Master's Colleges & Universities,"Ashland, OH",www.ashland.edu,www.goashlandeagles.com
Wayne State College (Nebraska),Division II,Division II,Non-DI,Active Member,Northern Sun Intercollegiate Conference,Northern Sun Intercollegiate Conference,Non-HBCU,Public,Master's Colleges & Universities,"Wayne, NE",www.wsc.edu/,www.wscwildcats.com/
Wilson College,Division III,Division III,Non-DI,Active Member,Colonial States Athletic Conference,Colonial States Athletic Conference,Non-HBCU,Private,Master's Colleges & Universities,"Chambersburg, PA",www.wilson.edu,www.wilsonphoenix.com
Beloit College,Division III,Division III,Non-DI,Active Member,Midwest Conference,Midwest Conference,Non-HBCU,Private,Baccalaureate Colleges,"Beloit, WI",www.beloit.edu,www.beloit.edu/bucs/
The State University of New York at Fredonia,Division III,Division III,Non-DI,Active Member,State University of New York Athletic Conference,State University of New York Athletic Conference,Non-HBCU,Public,Master's Colleges & Universities,"Fredonia, NY",www.fredonia.edu,www.fredoniabluedevils.com
Hilbert College,Division III,Division III,Non-DI,Active Member,Allegheny Mountain Collegiate Conference,Allegheny Mountain Collegiate Conference,Non-HBCU,Private,Baccalaureate Colleges,"Hamburg, NY",www.hilbert.edu,www.hilberthawks.com
Niagara University,Division I,Division I,DI Subdivision,Active Member,Metro Atlantic Athletic Conference,Metro Atlantic Athletic Conference,Non-HBCU,Private,Master's Colleges & Universities,"Niagara University, NY",www.niagara.edu,www.purpleeagles.com
"College at Brockport, State University of New York",Division III,Division III,Non-DI,Active Member,State University of New York Athletic Conference,State University of New York Athletic Conference,Non-HBCU,Public,Master's Colleges & Universities,"Brockport, NY",gobrockport.com,www.brockport.edu
Wells College,Division III,Division III,Non-DI,Active Member,North Eastern Athletic Conference,North Eastern Athletic Conference,Non-HBCU,Private,Baccalaureate Colleges,"Aurora, NY",www.wells-express.com,www.wells.edu
Binghamton University,Division I,Division I,DI Subdivision,Active Member,America East Conference,America East Conference,Non-HBCU,Public,Research Universities,"Binghamton, NY",www.binghamton.edu,www.bubearcats.com
Ithaca College,Division III,Division III,Non-DI,Active Member,Liberty League,Liberty League,Non-HBCU,Private,Master's Colleges & Universities,"Ithaca, NY",athletics.ithaca.edu,www.ithaca.edu/
Elmira College,Division III,Division III,Non-DI,Active Member,Empire 8,Empire 8,Non-HBCU,Private,Baccalaureate Colleges,"Elmira, NY",athletics.elmira.edu,www.elmira.edu
Mansfield University of Pennsylvania,Division II,Division II,Non-DI,Active Member,Pennsylvania State Athletic Conference,Pennsylvania State Athletic Conference,Non-HBCU,Public,Baccalaureate Colleges,"Mansfield, PA",www.gomounties.com,www.mansfield.edu
Misericordia University,Division III,Division III,Non-DI,Active Member,Middle Atlantic Conferences,Middle Atlantic Conference Freedom,Non-HBCU,Private,Research Universities,"Dallas, PA",www.misericordia.edu/,www.misericordia.edu/athletics
Clarks Summit University,Division III,Division III,Non-DI,Active Member,Colonial States Athletic Conference,Colonial States Athletic Conference,Non-HBCU,Private,Special Focus Schools,"Clarks Summit, PA",www.clarkssummitu.edu,www.gocsudefenders.com
Bloomsburg University of Pennsylvania,Division II,Division II,Non-DI,Active Member,Pennsylvania State Athletic Conference,Pennsylvania State Athletic Conference,Non-HBCU,Public,Master's Colleges & Universities,"Bloomsburg, PA",www.bloomu.edu,www.buhuskies.com
Lock Haven University of Pennsylvania,Division II,Division II,Non-DI,Active Member,Pennsylvania State Athletic Conference,Pennsylvania State Athletic Conference,Non-HBCU,Public,Master's Colleges & Universities,"Lock Haven, PA",www.golhu.com,www.lhup.edu/
Pennsylvania College of Technology,Division III,Division III,Non-DI,Active Member,North Eastern Athletic Conference,North Eastern Athletic Conference,Non-HBCU,Public,Baccalaureate Colleges,"Williamsport, PA",athletics.pct.edu,www.pct.edu
Bucknell University,Division I,Division I,DI FCS,Active Member,Patriot League,Patriot League,Non-HBCU,Private,Baccalaureate Colleges,"Lewisburg, PA",bucknell.edu,bucknellbison.com
Pennsylvania State University,Division I,Division I,DI FBS,Active Member,Big Ten Conference,Big Ten Conference,Non-HBCU,Public,Research Universities,"University Park, PA",goPSUsports.com,www.psu.edu
"Penn State University, Altoona",Division III,Division III,Non-DI,Active Member,Allegheny Mountain Collegiate Conference,Allegheny Mountain Collegiate Conference,Non-HBCU,Public,Baccalaureate Colleges,"Altoona, PA",www.altoona.psu.edu,www.altoona.psu.edu/sports
Indiana University of Pennsylvania,Division II,Division II,Non-DI,Active Member,Pennsylvania State Athletic Conference,Pennsylvania State Athletic Conference,Non-HBCU,Public,Research Universities,"Indiana, PA",www.iup.edu/,www.iupathletics.com/
"University of Pittsburgh, Greensburg",Division III,Division III,Non-DI,Active Member,Allegheny Mountain Collegiate Conference,Allegheny Mountain Collegiate Conference,Non-HBCU,Public,Baccalaureate Colleges,"Greensburg, PA",pittgreensburgathletics.com/,www.greensburg.pitt.edu/
Washington and Jefferson College,Division III,Division III,Non-DI,Active Member,Presidents' Athletic Conference,Presidents' Athletic Conference,Non-HBCU,Private,Baccalaureate Colleges,"Washington, PA",www.gopresidents.com,www.washjeff.edu
Chatham University,Division III,Division III,Non-DI,Active Member,Presidents' Athletic Conference,Presidents' Athletic Conference,Non-HBCU,Private,Research Universities,"Pittsburgh, PA",www.chatham.edu,www.gochathamcougars.com
University of Mississippi,Division I,Division I,DI FBS,Active Member,Southeastern Conference,Southeastern Conference,Non-HBCU,Public,Research Universities,"University, MS",www.olemiss.edu,www.olemisssports.com
Harding University,Division II,Division II,Non-DI,Active Member,Great American Conference,Great American Conference,Non-HBCU,Private,Research Universities,"Searcy, AR",www.harding.edu,www.hardingsports.com
Troy University,Division I,Division I,DI FBS,Active Member,Sun Belt Conference,Sun Belt Conference,Non-HBCU,Public,Master's Colleges & Universities,"Troy, AL",www.troy.edu,www.troytrojans.com
University of Miami (Florida),Division I,Division I,DI FBS,Active Member,Atlantic Coast Conference,Atlantic Coast Conference,Non-HBCU,Private,Research Universities,"Coral Gables, FL",www.hurricanesports.com,www.miami.edu
Florida International University,Division I,Division I,DI FBS,Active Member,Conference USA,Conference USA,Non-HBCU,Public,Research Universities,"Miami, FL",www.fiu.edu,www.fiusports.com
Florida Atlantic University,Division I,Division I,DI FBS,Active Member,Conference USA,Conference USA,Non-HBCU,Public,Research Universities,"Boca Raton, FL",fausports.collegesports.com/,www.fau.edu
Nova Southeastern University,Division II,Division II,Non-DI,Active Member,Sunshine State Conference,Sunshine State Conference,Non-HBCU,Private,Research Universities,"Fort Lauderdale, FL",www.nova.edu,www.nsusharks.com
Florida Institute of Technology,Division II,Division II,Non-DI,Active Member,Sunshine State Conference,Sunshine State Conference,Non-HBCU,Private,Research Universities,"Melbourne, FL",www.fit.edu,www.floridatechsports.com
Palm Beach Atlantic University,Division II,Division II,Non-DI,Active Member,Sunshine State Conference,Sunshine State Conference,Non-HBCU,Private,Research Universities,"West Palm Beach, FL",www.pba.edu,www.pbasailfish.com
Florida Gulf Coast University,Division I,Division I,DI Subdivision,Active Member,ASUN Conference,ASUN Conference,Non-HBCU,Public,Master's Colleges & Universities,"Fort Myers, FL",www.fgcu.edu,www.fgcuathletics.com
University of Tampa,Division II,Division II,Non-DI,Active Member,Sunshine State Conference,Sunshine State Conference,Non-HBCU,Private,Master's Colleges & Universities,"Tampa, FL",www.tampaspartans.com,www.ut.edu
Eckerd College,Division II,Division II,Non-DI,Active Member,Sunshine State Conference,Sunshine State Conference,Non-HBCU,Private,Baccalaureate Colleges,"St. Petersburg, FL",www.eckerd.edu/,www.eckerdtritons.com
University of South Florida,Division I,Division I,DI FBS,Active Member,American Athletic Conference,American Athletic Conference,Non-HBCU,Public,Research Universities,"Tampa, FL",www.gousfbulls.com/,www.usf.edu/
Savannah State University,Division I,Division I,DI FCS,Reclass DI to DII,Southern Intercol. Ath. Conf.,Southern Intercol. Ath. Conf.,HBCU,Public,Master's Colleges & Universities,"Savannah, GA",ssuathletics.com/,www.savannahstate.edu
Valdosta State University,Division II,Division II,Non-DI,Active Member,Gulf South Conference,Gulf South Conference,Non-HBCU,Public,Research Universities,"Valdosta, GA",www.valdosta.edu/,www.vstateblazers.com
Georgia Southern University,Division I,Division I,DI FBS,Active Member,Sun Belt Conference,Sun Belt Conference,Non-HBCU,Public,Research Universities,"Statesboro, GA",www.georgiasouthern.edu,www.gseagles.com/
Albany State University (Georgia),Division II,Division II,Non-DI,Active Member,Southern Intercol. Ath. Conf.,Southern Intercol. Ath. Conf.,HBCU,Public,Master's Colleges & Universities,"Albany, GA",www.asugoldenrams.com,www.asurams.edu
Mercer University,Division I,Division I,DI FCS,Active Member,Southern Conference,Southern Conference,Non-HBCU,Private,Research Universities,"Macon, GA",www.mercerbears.com,www2.mercer.edu/default.htm
Georgia College,Division II,Division II,Non-DI,Active Member,Peach Belt Conference,Peach Belt Conference,Non-HBCU,Public,Master's Colleges & Universities,"Milledgeville, GA",www.gcbobcats.com,www.gcsu.edu
University of Georgia,Division I,Division I,DI FBS,Active Member,Southeastern Conference,Southeastern Conference,Non-HBCU,Public,Research Universities,"Athens, GA",www.georgiadogs.com,www.uga.edu
University of North Georgia,Division II,Division II,Non-DI,Active Member,Peach Belt Conference,Peach Belt Conference,Non-HBCU,Public,Master's Colleges & Universities,"Dahlonega, GA",www.ung.edu/,www.ungathletics.com
Berry College,Division III,Division III,Non-DI,Active Member,Southern Athletic Association,Southern Athletic Association,Non-HBCU,Private,Master's Colleges & Universities,"Mount Berry, GA",www.berry.edu,www.berryvikings.com
Kennesaw State University,Division I,Division I,DI FCS,Active Member,ASUN Conference,ASUN Conference,Non-HBCU,Public,Research Universities,"Kennesaw, GA",www.kennesaw.edu/,www.ksuowls.com
Oglethorpe University,Division III,Division III,Non-DI,Active Member,Southern Athletic Association,Southern Athletic Association,Non-HBCU,Private,Baccalaureate Colleges,"Atlanta, GA",www.gopetrels.com,www.oglethorpe.edu/
Georgia State University,Division I,Division I,DI FBS,Active Member,Sun Belt Conference,Sun Belt Conference,Non-HBCU,Public,Research Universities,"Atlanta, GA",www.georgiastatesports.com,www.gsu.edu
University of West Georgia,Division II,Division II,Non-DI,Active Member,Gulf South Conference,Gulf South Conference,Non-HBCU,Public,Research Universities,"Carrollton, GA",www.uwgsports.com,www.westga.edu
Georgia Southwestern State University,Division II,Division II,Non-DI,Active Member,Peach Belt Conference,Peach Belt Conference,Non-HBCU,Public,Master's Colleges & Universities,"Americus, GA",www.gsw.edu,www.gswcanes.com
Columbus State University,Division II,Division II,Non-DI,Active Member,Peach Belt Conference,Peach Belt Conference,Non-HBCU,Public,Master's Colleges & Universities,"Columbus, GA",csucougars.com,www.columbusstate.edu
Charleston Southern University,Division I,Division I,DI FCS,Active Member,Big South Conference,Big South Conference,Non-HBCU,Private,Master's Colleges & Universities,"Charleston, SC",www.csuniv.edu,www.csusports.com
Claflin University,Division II,Division II,Non-DI,Active Member,Central Intercollegiate Athletic Association,Peach Belt Conference,HBCU,Private,Baccalaureate Colleges,"Orangeburg, SC",www.Claflin.edu,www.claflin.edu/athletics/
Benedict College,Division II,Division II,Non-DI,Active Member,Southern Intercol. Ath. Conf.,Southern Intercol. Ath. Conf.,HBCU,Private,Baccalaureate Colleges,"Columbia, SC",benedicttigers.com,www.benedict.edu
